{
  "$schema": "https://json-schema.org/draft/2020-12/schema",
  "$id": "https://agentlens.dev/schemas/agentlens.eval.v1.json",
  "$comment": "v1 is locked. Breaking changes require v2 namespace.",
  "title": "agentlens.eval.v1",
  "type": "object",
  "additionalProperties": false,
  "required": [
    "schema",
    "run_id",
    "evaluated_at",
    "status",
    "agent_outcome",
    "checks",
    "failures"
  ],
  "properties": {
    "schema": {
      "type": "string",
      "const": "agentlens.eval.v1"
    },
    "run_id": {
      "type": "string"
    },
    "evaluated_at": {
      "type": "string",
      "pattern": "^\\d{4}-\\d{2}-\\d{2}T\\d{2}:\\d{2}:\\d{2}(\\.\\d+)?Z$"
    },
    "status": {
      "type": "string",
      "enum": ["passed", "failed", "incomplete", "needs_eval", "error"]
    },
    "agent_outcome": {
      "type": "string",
      "enum": ["success", "failed", "partial", "cancelled", "unknown"]
    },
    "evidence_coverage": {
      "type": "object",
      "additionalProperties": false,
      "required": [
        "producer",
        "observability",
        "event_count",
        "timeline_event_count",
        "internal_actions",
        "payload_safety",
        "strength",
        "artifacts",
        "coverage",
        "gates",
        "projection"
      ],
      "properties": {
        "producer": {
          "type": "string",
          "const": "agentrunway"
        },
        "observability": {
          "type": "string",
          "enum": ["present", "missing", "not_applicable", "disabled", "failed"]
        },
        "event_count": {
          "type": "integer",
          "minimum": 0
        },
        "timeline_event_count": {
          "type": "integer",
          "minimum": 0
        },
        "internal_actions": {
          "type": "integer",
          "minimum": 0
        },
        "payload_safety": {
          "type": "string",
          "enum": ["ok", "oversized"]
        },
        "strength": {
          "type": "string",
          "enum": ["strong", "partial", "weak", "none"]
        },
        "artifacts": {
          "type": "object",
          "additionalProperties": false,
          "required": ["contract", "artifact_graph", "coverage"],
          "properties": {
            "contract": {
              "type": "string",
              "enum": ["present", "missing"]
            },
            "artifact_graph": {
              "type": "string",
              "enum": ["present", "missing"]
            },
            "coverage": {
              "type": "string",
              "enum": ["present", "missing"]
            }
          }
        },
        "coverage": {
          "type": "object",
          "additionalProperties": false,
          "required": ["covered", "partial", "blocked", "unreferenced"],
          "properties": {
            "covered": {
              "type": "array",
              "items": {"type": "string"}
            },
            "partial": {
              "type": "array",
              "items": {"type": "string"}
            },
            "blocked": {
              "type": "array",
              "items": {"type": "string"}
            },
            "unreferenced": {
              "type": "array",
              "items": {"type": "string"}
            }
          }
        },
        "gates": {
          "type": "object",
          "additionalProperties": false,
          "required": ["retry_count", "review_results", "verification_results"],
          "properties": {
            "retry_count": {
              "type": "integer",
              "minimum": 0
            },
            "review_results": {
              "type": "integer",
              "minimum": 0
            },
            "verification_results": {
              "type": "integer",
              "minimum": 0
            }
          }
        },
        "projection": {
          "type": "object"
        }
      }
    },
    "projection_ref": {
      "type": "string"
    },
    "trust_report_ref": {
      "type": "string"
    },
    "trust_report": {
      "type": "object"
    },
    "checks": {
      "type": "array",
      "items": {
        "type": "object",
        "additionalProperties": false,
        "required": ["name", "status"],
        "properties": {
          "name": {
            "type": "string"
          },
          "status": {
            "type": "string",
            "enum": ["passed", "failed", "skipped"]
          },
          "message": {
            "type": "string"
          },
          "evidence": {
            "type": "array",
            "items": {
              "type": "string"
            }
          }
        }
      }
    },
    "failures": {
      "type": "array",
      "items": {
        "type": "object",
        "additionalProperties": false,
        "required": [
          "category",
          "severity",
          "source",
          "blame_scope",
          "recoverability",
          "confidence",
          "summary",
          "evidence"
        ],
        "properties": {
          "category": {
            "type": "string",
            "enum": [
              "MISSING_FINAL",
              "INVALID_RUN_SCHEMA",
              "INVALID_EVENT_SCHEMA",
              "INVALID_FINAL_SCHEMA",
              "INVALID_MANIFEST_SCHEMA",
              "MISSING_VERIFICATION_EVIDENCE",
              "UNACKNOWLEDGED_FAILED_COMMAND",
              "SUCCESS_WITH_RESIDUAL_RISK",
              "ARTIFACT_HASH_MISMATCH",
              "MANIFEST_NOT_SEALED",
              "RECORDING_INCOMPLETE",
              "EVALUATOR_ERROR",
              "COMMAND_TIMEOUT",
              "ENVIRONMENT_BLOCKER",
              "DIFF_SCOPE_UNKNOWN",
              "CHANGED_FILES_MISSING",
              "AGENT_REPORTED_GAP",
              "USER_CORRECTION",
              "UNKNOWN"
            ]
          },
          "severity": {
            "type": "string",
            "enum": ["low", "medium", "high", "critical"]
          },
          "source": {
            "type": "string",
            "enum": ["agent_reported", "evaluator", "user_reported", "imported"]
          },
          "blame_scope": {
            "type": "string",
            "enum": ["agent", "project", "environment", "user", "unknown"]
          },
          "recoverability": {
            "type": "string",
            "enum": [
              "informational",
              "retry",
              "rerun_or_fix",
              "needs_user",
              "non_recoverable"
            ]
          },
          "confidence": {
            "type": "number",
            "minimum": 0,
            "maximum": 1
          },
          "summary": {
            "type": "string",
            "maxLength": 4096
          },
          "evidence": {
            "type": "array",
            "items": {
              "type": "string"
            }
          }
        }
      }
    }
  }
}
