{
  "agent_outcome": "unknown",
  "checks": [
    {
      "message": "final.json absent",
      "name": "agent_outcome_valid",
      "status": "skipped"
    },
    {
      "name": "artifact_hashes_valid",
      "status": "passed"
    },
    {
      "message": "check applies only when agent_outcome=success",
      "name": "changed_files_present_when_success",
      "status": "skipped"
    },
    {
      "message": "no command.started events to resolve",
      "name": "commands_resolved",
      "status": "passed"
    },
    {
      "name": "events_well_formed",
      "status": "passed"
    },
    {
      "name": "failed_commands_acknowledged",
      "status": "passed"
    },
    {
      "message": "final.json not found",
      "name": "final_present",
      "status": "failed"
    },
    {
      "name": "manifest_sealed",
      "status": "passed"
    },
    {
      "message": "final.json absent",
      "name": "residual_risks_explicit",
      "status": "skipped"
    },
    {
      "name": "run_started",
      "status": "passed"
    },
    {
      "name": "schema_valid",
      "status": "passed"
    },
    {
      "message": "check applies only when agent_outcome=success",
      "name": "verification_present",
      "status": "skipped"
    }
  ],
  "evaluated_at": "1970-01-01T00:00:00Z",
  "evidence_coverage": {
    "artifacts": {
      "artifact_graph": "missing",
      "contract": "missing",
      "coverage": "missing"
    },
    "coverage": {
      "blocked": [],
      "covered": [],
      "partial": [],
      "unreferenced": []
    },
    "event_count": 0,
    "gates": {
      "retry_count": 0,
      "review_results": 0,
      "verification_results": 0
    },
    "internal_actions": 0,
    "observability": "not_applicable",
    "payload_safety": "ok",
    "producer": "agentrunway",
    "projection": {
      "agentlens_emit_health": {
        "last_status": "unknown",
        "statuses": {}
      },
      "artifacts": {
        "artifact_graph": "missing",
        "contract": "missing",
        "coverage": "missing"
      },
      "blocked_tasks": [],
      "coverage": {
        "blocked": [],
        "covered": [],
        "partial": [],
        "unreferenced": []
      },
      "event_count": 0,
      "gate_retries": [],
      "internal_actions": 0,
      "merge": {
        "conflicts": [],
        "ready": false
      },
      "payload_safety": "ok",
      "producer": "agentrunway",
      "run_id": null,
      "status": "not_started",
      "tasks": {},
      "timeline": []
    },
    "strength": "none",
    "timeline_event_count": 0
  },
  "failures": [
    {
      "blame_scope": "agent",
      "category": "MISSING_FINAL",
      "confidence": 1.0,
      "evidence": [],
      "recoverability": "rerun_or_fix",
      "severity": "high",
      "source": "evaluator",
      "summary": "final.json was not written before evaluation"
    }
  ],
  "run_id": "run_20260101_000002_cccccc",
  "schema": "agentlens.eval.v1",
  "status": "incomplete"
}
