{
  "agent_outcome": "success",
  "checks": [
    {
      "name": "agent_outcome_valid",
      "status": "passed"
    },
    {
      "name": "artifact_hashes_valid",
      "status": "passed"
    },
    {
      "name": "changed_files_present_when_success",
      "status": "passed"
    },
    {
      "name": "commands_resolved",
      "status": "passed"
    },
    {
      "name": "events_well_formed",
      "status": "passed"
    },
    {
      "name": "failed_commands_acknowledged",
      "status": "passed"
    },
    {
      "name": "final_present",
      "status": "passed"
    },
    {
      "name": "manifest_sealed",
      "status": "passed"
    },
    {
      "message": "success outcome with medium+ residual risk (1 entries)",
      "name": "residual_risks_explicit",
      "status": "failed"
    },
    {
      "name": "run_started",
      "status": "passed"
    },
    {
      "name": "schema_valid",
      "status": "passed"
    },
    {
      "name": "verification_present",
      "status": "passed"
    }
  ],
  "evaluated_at": "1970-01-01T00:00:00Z",
  "failures": [
    {
      "blame_scope": "agent",
      "category": "SUCCESS_WITH_RESIDUAL_RISK",
      "confidence": 1.0,
      "evidence": [
        "severity=high: credentials may have been logged to disk; user must rotate"
      ],
      "recoverability": "needs_user",
      "severity": "high",
      "source": "evaluator",
      "summary": "agent reported success but left medium+ residual risk"
    }
  ],
  "run_id": "run_20260101_000003_dddddd",
  "schema": "agentlens.eval.v1",
  "status": "failed"
}
